Chat Session,Message Date,Delivered Date,Read Date,Edited Date,Service,Type,Sender ID,Sender Name,Status,Replying to,Subject,Text,Attachment,Attachment type
Tucker LowTide,2024-05-13 17:51:02,,2024-05-13 18:29:12,,iMessage,Incoming,+18134429109,Tucker LowTide,Read,,,Tucker ,,
Tucker LowTide,2024-05-25 23:17:30,2024-05-25 23:17:31,,2024-05-25 23:17:59,iMessage,Outgoing,,,Delivered,,,"hi tucker, hope your event went well my friend!

my wife is on day 3 of being brutally sick but is on the mend. 

was afraid this might happen but was sad to miss it and had to stay back. 

would love to see any video if someone happened to record it. 

see you at LT soon - Steve",,
