Chat Session,Message Date,Delivered Date,Read Date,Edited Date,Service,Type,Sender ID,Sender Name,Status,Replying to,Subject,Text,Attachment,Attachment type
Eric Tocci & John Winchell,2023-06-13 16:53:57,,,,iMessage,Outgoing,,,Sent,,,"Tocci, This is my cousin in law -  John Winchell, lover of all things golf. He wants to participate in the draft kings pool if you’re looking to grow it more. 

Jswinchell22@gmail.com",,
Eric Tocci & John Winchell,2023-06-13 17:12:14,,2023-06-13 17:28:22,,iMessage,Incoming,+16105095815,Eric Tocci,Read,,,"Hey John, nice to meet you. I just forwarded you the email and will add you going forward. It’s a 6 player lineup, $25 winner-take-all. My venmo is @eric-tocci",,
Eric Tocci & John Winchell,2023-06-13 19:23:54,,2023-06-13 19:31:31,,iMessage,Incoming,+19733035148,John Winchell,Read,,,Thanks for including me! In DK is this a private pool? ,,
Eric Tocci & John Winchell,2023-06-13 19:25:10,,2023-06-13 19:31:31,,iMessage,Incoming,+16105095815,Eric Tocci,Read,,,"It is, send over the entry fee and I’ll send the link",,
Eric Tocci & John Winchell,2023-06-13 20:46:00,,2023-06-13 21:47:15,,iMessage,Incoming,+19733035148,John Winchell,Read,,,Sounds good! ,,
