Chat Session,Message Date,Delivered Date,Read Date,Edited Date,Service,Type,Sender ID,Sender Name,Status,Replying to,Subject,Text,Attachment,Attachment type
+13163529980,2024-05-08 14:00:47,,2024-05-08 14:03:00,,SMS,Incoming,+13163529980,,Read,,,Thanks! You'll now receive Patient Alerts from Elite DNA. Msg&data rates may apply. Txt HELP for help. Reply STOP to opt out.,,
+13163529980,2024-05-08 16:08:57,,,,SMS,Outgoing,,,Sent,,,Yes,,
+13163529980,2024-05-08 16:39:29,,2024-05-08 16:40:25,,SMS,Incoming,+13163529980,,Read,,,We are unable to update your appt at this time. Please try again after 15 minutes or contact us to confirm or cancel/ reschedule,,
+13163529980,2024-06-19 09:12:33,,2024-06-19 09:54:54,,SMS,Incoming,+13163529980,,Read,,,"The balance for your recent appt with FL - DNA Comprehe... is ready to view and pay: https://ahmsg.us/3VLZVTQ Reply STOP to opt out.

",,
+13163529980,2024-06-21 09:06:31,2024-06-21 11:56:54,2024-06-21 11:56:54,,SMS,Incoming,+13163529980,,Read,,,It's easy to take care of your balance for your recent appt with FL - DNA Comprehe.... Visit https://ahmsg.us/4c5osJ8 Reply STOP to opt out.,,
