Chat Session,Message Date,Delivered Date,Read Date,Edited Date,Service,Type,Sender ID,Sender Name,Status,Replying to,Subject,Text,Attachment,Attachment type
Michael Phillips,2023-10-16 17:12:32,,2023-10-16 17:26:53,,iMessage,Incoming,+18138179549,Michael Phillips,Read,,,Hey there! This is Michael Phillips. I got your voicemail just now. Can we set up a time tomorrow for a quick chat? I should be available anytime. Just let me know what works for you!,,
Michael Phillips,2023-10-16 17:59:37,,,,iMessage,Outgoing,,,Delivered,,,Are you free around 930am tomorrow?,,
Michael Phillips,2023-10-16 17:59:52,,,,iMessage,Outgoing,,,Delivered,,,That or 1-3:30pm tomorrow is flexible enough for a call,,
Michael Phillips,2023-10-16 18:00:02,,,,iMessage,Outgoing,,,Delivered,,,and thank you for the quick reply!,,
Michael Phillips,2023-10-16 18:08:08,,2023-10-16 18:11:13,,iMessage,Incoming,+18138179549,Michael Phillips,Read,,,930 will work. I can give you a call then. Flexible all day. So if you need to change it just let me know. Talk to you then!,,
