Chat Session,Message Date,Delivered Date,Read Date,Edited Date,Service,Type,Sender ID,Sender Name,Status,Replying to,Subject,Text,Attachment,Attachment type
Michael Phillips & Melissa,2023-10-17 09:42:57,,,,iMessage,Outgoing,,,Sent,,,"Mike, setting up a group text for you, me, and Melissa. The best email for us is:

stephenandmelissaboerner@gmail.com

Text is easier for links, addresses, etc.",,
Michael Phillips & Melissa,2023-10-18 17:15:47,,2023-10-18 17:24:07,,iMessage,Incoming,+18138179549,Michael Phillips,Read,,,Good evening! I sent a detailed email yesterday and a follow up email with a few properties earlier this afternoon. Let me know if you have any questions or concerns!,,
Michael Phillips & Melissa,2023-10-18 17:24:30,,,,iMessage,Outgoing,,,Sent,,,Thank you we are reviewing this evening,,
